Name;Beschreibung;ProduktID;Preis;BildLink;
Anno 1800;Lead the Industrial Revolution! Welcome to the beginning of the industrial age. Choose your path and change your world with it. Are you a visionary or an exploiter? A conqueror or a liberator? You alone decide how you go down in history.;57233784;59.99;https://cdn1.epicgames.com/offer/oregano/ANNO_Store_Landscape_1920x1080_1920x1080-cea85f12443da424bef2a30a20be060b_1920x1080-cea85f12443da424bef2a30a20be060b;https://store.steampowered.com/app/916440/Anno_1800/
theHunter Call of the Wild;Experience an unrivaled atmospheric hunting game set in a realistic and stunning open world. Play the single player campaign or experience the ultimate hunting experience with your friends in multiplayer.;28132387;19.99;https://cdn1.epicgames.com/salesEvent/salesEvent/EGS_theHunterCalloftheWild2022Edition_ExpansiveWorlds_Bundles_S1_2560x1440-5ece927983f6f73f6d3fbf4b0a453908;https://store.steampowered.com/app/518790/theHunter_Call_of_the_Wild/
Overcooked! 2;Overcooked returns with a brand new second batch of mayhem cooking action! Return to the Onion Kingdom and assemble your team of chefs in classic couch co-op or online play for up to four players. Hold on to your aprons... It's (again) time to save the world!;66470073;22.99;https://images8.alphacoders.com/927/thumb-1920-927790.png;https://store.steampowered.com/app/728880/Overcooked_2/
War Thunder;War Thunder is a free-to-play cross-platform MMO combat game dedicated to the military vehicles of WWII and Korean War. Take part in air, land and sea battles of epic proportions with players from all over the world.;91865823;Free;https://cdn.discordapp.com/attachments/530062005286076446/1050881603540357171/1920x1080_logo_fire_and_ice_finnish_ground_forces_eng_2589dca47849801babaa7291e7c725df.jpg;https://store.steampowered.com/app/236390/War_Thunder/
Cyberpunk 2077;Cyberpunk 2077 is an open-world action-adventure RPG set in Night City - a dangerous metropolis whose denizens are obsessed with power, glamor and body modification.;40310926;59.99;https://whatifgaming.com/wp-content/uploads/2020/12/V-from-Cyberpunk-2077.jpg;https://store.steampowered.com/app/1091500/Cyberpunk_2077/